{
  "$schema": "../schemas/v1-content-catalog.schema.json",
  "schemaVersion": "1.0.0",
  "release": "1.0",
  "contentTargets": {
    "mainMinutes": 945,
    "mainAndSideMinutes": 1395,
    "completionistMinutes": 1800,
    "regions": 3,
    "subregions": 18,
    "bosses": 14,
    "coreNpcs": 24,
    "combatSystems": 2,
    "weaponFamilies": 2,
    "mainChapters": 21,
    "sideQuestChains": 18,
    "pointsOfInterest": 120
  },
  "combatSystems": [
    {
      "id": "combat_guarded_arms",
      "name": "护牒兵击",
      "purpose": "承担实时动作、位置博弈、攻防读招与武器表达。",
      "coreLoop": ["识招", "守势或闪身", "破绽打击", "积累失序", "处决窗口"],
      "progressionStages": ["基础攻防", "武器架势", "协作技", "宗师变式"],
      "sharedResources": ["体力", "定力", "工灯势"]
    },
    {
      "id": "combat_lantern_seal",
      "name": "工灯定印",
      "purpose": "把观察、工艺判断与环境修复嵌入战斗，使胜利终点从击杀转为归位。",
      "coreLoop": ["照见工序", "辨认错位", "布置工印", "触发环境协作", "归位裁定"],
      "progressionStages": ["单点照见", "双印联动", "动态改序", "领域归位"],
      "sharedResources": ["工灯势", "证据槽", "归位窗口"]
    }
  ],
  "weapons": [
    {
      "id": "weapon_umbrella",
      "name": "伞器",
      "combatIdentity": "中距离控场、精确格挡、借风位移与同伴掩护。",
      "stances": ["檐守", "翻花", "风渡"],
      "craftDomains": ["伞骨", "纸面", "桐油", "铰轴"],
      "masteryCapstone": "四时合伞",
      "futureHooks": ["队伍护域", "天气共鸣", "机关滑翔"]
    },
    {
      "id": "weapon_sword",
      "name": "剑器",
      "combatIdentity": "近身精确压制、架势切换、蓄锋反击与淬火属性调校。",
      "stances": ["试锋", "藏锋", "回炉"],
      "craftDomains": ["选矿", "叠锻", "淬火", "研磨"],
      "masteryCapstone": "百炼归一",
      "futureHooks": ["双器协奏", "剑纹铭契", "断刃重铸"]
    }
  ],
  "regions": [
    {
      "id": "region_jiangnan",
      "name": "江南水路",
      "theme": "雨、伞、河工与市井信用；学习看见器物背后的人。",
      "mainMinutes": 315,
      "sideMinutes": 150,
      "completionistMinutes": 600,
      "mainChapters": 7,
      "sideQuestChains": 6,
      "pointsOfInterest": 42,
      "subregions": [
        {
          "id": "jn_rain_ferry",
          "name": "雨渡镇口",
          "role": "教学枢纽与日程社会",
          "signatureMechanic": "雨势、檐下路线与熟人引荐",
          "bossIds": [],
          "npcIds": ["npc_shen_yan", "npc_chu_granny", "npc_qi_zhaoshui"]
        },
        {
          "id": "jn_umbrella_lane",
          "name": "纸伞作坊街",
          "role": "伞器生产线与首个工艺调查",
          "signatureMechanic": "伞骨张力、纸面含水率与工位协作",
          "bossIds": ["jn_boss_umbrella_wraith"],
          "npcIds": ["npc_shen_yan", "npc_mo_ming"]
        },
        {
          "id": "jn_listening_market",
          "name": "听雨市",
          "role": "交易、声誉与多解支线中心",
          "signatureMechanic": "叫卖声线索、价格波动与摊主关系",
          "bossIds": ["jn_boss_rain_market_bell"],
          "npcIds": ["npc_luo_qinghe", "npc_chu_granny"]
        },
        {
          "id": "jn_dye_courts",
          "name": "染河庭",
          "role": "水质调查与颜色工印教学",
          "signatureMechanic": "分流、固色与污染源追踪",
          "bossIds": ["jn_boss_dye_vat_mirror"],
          "npcIds": ["npc_a_tang", "npc_ji_qing"]
        },
        {
          "id": "jn_old_bridge_forks",
          "name": "旧桥汊",
          "role": "首次复合战斗与河道探索",
          "signatureMechanic": "水位改变通路、桥拱回声与舟战边界",
          "bossIds": ["jn_boss_tide_anchor_ledger"],
          "npcIds": ["npc_lu_tuan", "npc_ji_qing"]
        },
        {
          "id": "jn_outer_dike",
          "name": "外圩潮闸",
          "role": "地区终章、多人协作感与大型归位战",
          "signatureMechanic": "三段闸室、潮窗计时与群众撤护",
          "bossIds": ["jn_boss_outer_dike_anchor"],
          "npcIds": ["npc_lu_tuan", "npc_qi_zhaoshui", "npc_mo_ming"]
        }
      ]
    },
    {
      "id": "region_longquan",
      "name": "龙泉山炉",
      "theme": "矿脉、剑器与师承分歧；理解锋利必须服从用途。",
      "mainMinutes": 315,
      "sideMinutes": 150,
      "completionistMinutes": 600,
      "mainChapters": 7,
      "sideQuestChains": 6,
      "pointsOfInterest": 40,
      "subregions": [
        {
          "id": "lq_furnace_post",
          "name": "炉前驿",
          "role": "地区枢纽与剑器入门",
          "signatureMechanic": "炉温日程、运料队与试剑委托",
          "bossIds": [],
          "npcIds": ["npc_xie_linfeng", "npc_wen_lan", "npc_ye_xiaoli"]
        },
        {
          "id": "lq_magnetic_creek",
          "name": "磁砂溪",
          "role": "选矿探索与环境解谜",
          "signatureMechanic": "磁性牵引、砂层筛选与水轮复位",
          "bossIds": ["lq_boss_stone_lion"],
          "npcIds": ["npc_shi_qi", "npc_han_wenquan"]
        },
        {
          "id": "lq_sevenfold_mine",
          "name": "七曜矿谷",
          "role": "垂直矿区与风险取舍",
          "signatureMechanic": "矿脉共振、支护压力与照明资源",
          "bossIds": ["lq_boss_broken_blade_guard"],
          "npcIds": ["npc_shi_qi", "npc_ning_yulu"]
        },
        {
          "id": "lq_hundred_forges",
          "name": "百炼街",
          "role": "工坊竞合、锻造编辑器与装备深化",
          "signatureMechanic": "公开试锻、订单信誉与工序组合",
          "bossIds": ["lq_boss_thousand_hammers"],
          "npcIds": ["npc_xie_linfeng", "npc_ning_yulu", "npc_gu_hanxing"]
        },
        {
          "id": "lq_cloud_kiln_ridge",
          "name": "云窑脊",
          "role": "天气高地与护送长线关卡",
          "signatureMechanic": "风向助燃、雷雨退火与移动炉车",
          "bossIds": ["lq_boss_drinking_fire_well"],
          "npcIds": ["npc_zong_lishou", "npc_han_wenquan"]
        },
        {
          "id": "lq_earthfire_sword_pool",
          "name": "地火剑池",
          "role": "地区终章与剑器宗师考验",
          "signatureMechanic": "多层炉场、熔流改道与武器现场重调",
          "bossIds": ["lq_boss_sheathless_master"],
          "npcIds": ["npc_xie_linfeng", "npc_gu_hanxing", "npc_zong_lishou"]
        }
      ]
    },
    {
      "id": "region_huizhou",
      "name": "徽州墨岭",
      "theme": "墨、木、契约与远行商路；追问记录如何既约束又保护人。",
      "mainMinutes": 315,
      "sideMinutes": 150,
      "completionistMinutes": 600,
      "mainChapters": 7,
      "sideQuestChains": 6,
      "pointsOfInterest": 38,
      "subregions": [
        {
          "id": "hz_ink_port",
          "name": "徽墨埠",
          "role": "水陆枢纽、契约教学与墨材交易",
          "signatureMechanic": "货单核验、墨色溯源与码头潮汐",
          "bossIds": [],
          "npcIds": ["npc_cheng_monian", "npc_wang_shuyan", "npc_xiaoman"]
        },
        {
          "id": "hz_archway_lane",
          "name": "牌坊巷",
          "role": "家族记忆、建筑探索与舆论关系",
          "signatureMechanic": "梁柱受力、题刻证据与邻里口述",
          "bossIds": ["hz_boss_shadow_beam_bailiff"],
          "npcIds": ["npc_fang_jiusi", "npc_luo_qiheng"]
        },
        {
          "id": "hz_inkstone_creek",
          "name": "砚溪田",
          "role": "采集生态与慢节奏工艺链",
          "signatureMechanic": "水磨、石纹辨认与田渠共生",
          "bossIds": ["hz_boss_dry_inkstone_boat"],
          "npcIds": ["npc_xu_yanqiu", "npc_cheng_monian"]
        },
        {
          "id": "hz_wood_contract_forest",
          "name": "木契林",
          "role": "林业规则、路径推理与追猎",
          "signatureMechanic": "年轮定向、限伐契约与回声标记",
          "bossIds": ["hz_boss_ink_contract_moth"],
          "npcIds": ["npc_wu_zhaolin", "npc_zhu_xiuyun"]
        },
        {
          "id": "hz_cloud_ridge_academy",
          "name": "云岭书院",
          "role": "知识冲突、天工录历史与非战斗裁定",
          "signatureMechanic": "证据板、公开辩契与藏书空间重组",
          "bossIds": [],
          "npcIds": ["npc_luo_qiheng", "npc_wang_shuyan", "npc_xu_yanqiu"]
        },
        {
          "id": "hz_white_peak_trade_road",
          "name": "白岳商道",
          "role": "地区终章、长途护送与多系统总考",
          "signatureMechanic": "商队编组、山雾导航与契约动态改写",
          "bossIds": ["hz_boss_white_contract_tiger"],
          "npcIds": ["npc_zhu_xiuyun", "npc_xiaoman", "npc_wu_zhaolin"]
        }
      ]
    }
  ],
  "bosses": [
    {
      "id": "jn_boss_umbrella_wraith",
      "name": "四时伞祟",
      "regionId": "region_jiangnan",
      "rank": "chapter",
      "phases": ["春骨试张", "夏雨覆街", "秋风翻檐", "冬纸归白"],
      "coreMechanic": "在四种天气中调校伞面、格挡节奏与工印顺序。",
      "resolution": "找回被混装的四家伞骨谱并重新署名。"
    },
    {
      "id": "jn_boss_rain_market_bell",
      "name": "雨市鸣铎",
      "regionId": "region_jiangnan",
      "rank": "elite",
      "phases": ["乱价鸣", "百摊回声", "歇市静音"],
      "coreMechanic": "根据摊主叫卖节拍识别真声源，保护群众而非清场。",
      "resolution": "修复报时铎与市约之间脱节的轮值记录。"
    },
    {
      "id": "jn_boss_dye_vat_mirror",
      "name": "染缸照影",
      "regionId": "region_jiangnan",
      "rank": "elite",
      "phases": ["浮色", "夺色", "固色"],
      "coreMechanic": "引导三股水流稀释错误媒染剂，并用颜色证据拆解分身。",
      "resolution": "公开真正的污染来源并让受损染户共同复工。"
    },
    {
      "id": "jn_boss_tide_anchor_ledger",
      "name": "潮锚账影",
      "regionId": "region_jiangnan",
      "rank": "chapter",
      "phases": ["旧账拖锚", "桥汊封流", "账页还潮"],
      "coreMechanic": "在旧桥水位变化中核对虚实锚点；它是账册记忆，不是外圩实体。",
      "resolution": "补齐失踪船工的工钱与锚具去向。"
    },
    {
      "id": "jn_boss_outer_dike_anchor",
      "name": "外圩潮锚魇",
      "regionId": "region_jiangnan",
      "rank": "region",
      "phases": ["潮闸失锁", "三室倒灌", "万缆同牵", "无款归位"],
      "coreMechanic": "协同三座闸室、居民撤护与伞器导流，击破实体潮锚结构。",
      "resolution": "确认无款工印是被删去的公共维修责任，而非单一恶人署名。"
    },
    {
      "id": "lq_boss_stone_lion",
      "name": "炉息石猊",
      "regionId": "region_longquan",
      "rank": "elite",
      "phases": ["吞砂", "吐火", "冷却开纹"],
      "coreMechanic": "利用磁砂改变冲锋路径，并在冷却窗检查石腹炉胆。",
      "resolution": "恢复守溪熔炉的安全泄压用途。"
    },
    {
      "id": "lq_boss_broken_blade_guard",
      "name": "断纹剑侍",
      "regionId": "region_longquan",
      "rank": "chapter",
      "phases": ["试锋问名", "断纹追身", "双刃合证"],
      "coreMechanic": "读出断刃纹路方向，用守势诱导其完成缺失剑招。",
      "resolution": "证明事故来自错误矿批而非学徒偷工。"
    },
    {
      "id": "lq_boss_thousand_hammers",
      "name": "千锤回声",
      "regionId": "region_longquan",
      "rank": "chapter",
      "phases": ["一锤百应", "工坊争鸣", "同炉同拍"],
      "coreMechanic": "在多工位冲击波中建立正确锻打节拍。",
      "resolution": "把被竞争打散的联合大单重新分工。"
    },
    {
      "id": "lq_boss_drinking_fire_well",
      "name": "饮火井灵",
      "regionId": "region_longquan",
      "rank": "elite",
      "phases": ["井吸", "火雨", "退火雾"],
      "coreMechanic": "控制移动炉车、风向和井口压力，避免山火扩散。",
      "resolution": "恢复旧井作为公共退火池的身份。"
    },
    {
      "id": "lq_boss_sheathless_master",
      "name": "无鞘铸主",